id,name,summary,description,lat,lng,neighborhood,tags,year,borough,area,block,route_id,order,sources,images
george-washington-statue-1977,Equestrian Statue of George Washington,H.K. Brown bronze equestrian statue (1856).,By 1977 the 1856 bronze equestrian statue of George Washington continued to anchor Union Square’s south end and civic memory.,40.73537,-73.9907,Union Square,"[""public-art"", ""politics""]",1977,Manhattan,Union Square,14th St plaza (south end),USQ-1977,1,"[{""title"": ""Equestrian statue of George Washington (NYC Parks)"", ""publisher"": ""NYC Parks"", ""url"": ""https://www.nycgovparks.org/parks/union-square-park/monuments/1676""}, {""title"": ""Equestrian statue of George Washington (NYC)"", ""publisher"": ""Wikipedia"", ""url"": ""https://en.wikipedia.org/wiki/Equestrian_statue_of_George_Washington_(New_York_City)""}]","[{""url"": ""https://commons.wikimedia.org/wiki/File:GWashington_Union_Sq_jeh.jpg"", ""credit"": ""Jim.henderson (Wikimedia)"", ""license"": ""CC-BY-SA""}]"
tammany-hall-building-1977,Tammany Hall (44 Union Square East),Neo‑Georgian former Democratic machine HQ (opened 1929).,The 1929 Tammany Hall building at 44 Union Square East still stood in 1977; its association with NYC political power made it a local landmark.,40.73639,-73.98889,Union Square,"[""politics"", ""architecture"", ""scandal""]",1977,Manhattan,Union Square,E 17th St & Union Square East,USQ-1977,2,"[{""title"": ""44 Union Square (Tammany Hall)"", ""publisher"": ""Wikipedia"", ""url"": ""https://en.wikipedia.org/wiki/44_Union_Square""}, {""title"": ""The 1929 Tammany Hall \u2014 No. 100 East 17th Street"", ""publisher"": ""Daytonian in Manhattan"", ""url"": ""http://daytoninmanhattan.blogspot.com/2014/07/the-1929-tammany-hall-no-100-east-17th.html""}]",[]
maxs-kansas-city-1977,Max’s Kansas City (213 Park Ave South),Influential art/music club and restaurant (1965–1981).,"A magnet for artists and musicians—Velvet Underground, Bowie, Warhol’s circle—Max’s Kansas City remained a cultural touchstone in 1977 near Union Square.",40.7373,-73.98775,Union Square,"[""music"", ""celebrity"", ""culture""]",1977,Manhattan,Union Square,213 Park Ave S (at E 17th St),USQ-1977,3,"[{""title"": ""Max\u2019s Kansas City"", ""publisher"": ""Wikipedia"", ""url"": ""https://en.wikipedia.org/wiki/Max%27s_Kansas_City""}]","[{""url"": ""https://commons.wikimedia.org/wiki/File:Max%27s_Kansas_City.jpg"", ""credit"": ""Wikimedia Commons"", ""license"": ""CC-BY-SA""}]"
madison-square-park-1977,Madison Square Park,Historic park showing signs of revival in the 1970s.,"In 1977 the park’s historic layout persisted amid urban wear, with community events and chess tables hinting at the coming restorations of the 1990s–2000s.",40.742165,-73.988121,Flatiron District,"[""culture"", ""public-art""]",1977,Manhattan,Flatiron District,5th Ave (E 23rd–26th),FLAT-1977,1,"[{""title"": ""Madison Square Park \u2014 History"", ""publisher"": ""NYC Parks"", ""url"": ""https://www.nycgovparks.org/parks/madison-square-park/history""}, {""title"": ""Madison Square Park Conservancy \u2014 About the Park"", ""publisher"": ""Madison Square Park Conservancy"", ""url"": ""https://madisonsquarepark.org/park/about-the-park/""}]",[]
worth-monument-1977,General William Jenkins Worth Monument,1857 granite obelisk in Worth Square.,The 51‑foot granite obelisk honoring General Worth remained the centerpiece of Worth Square by 1977.,40.74276,-73.988974,Flatiron District,"[""public-art""]",1977,Manhattan,Flatiron District,Worth Square (Broadway & W 24th),FLAT-1977,2,"[{""title"": ""General William Jenkins Worth Monument"", ""publisher"": ""Wikipedia"", ""url"": ""https://en.wikipedia.org/wiki/General_William_Jenkins_Worth_Monument""}, {""title"": ""Worth Square"", ""publisher"": ""Wikipedia"", ""url"": ""https://en.wikipedia.org/wiki/Worth_Square""}]","[{""url"": ""https://commons.wikimedia.org/wiki/File:William_Jenkins_Worth_monument_4,_from_Robert_N._Dennis_collection_of_stereoscopic_views.jpg"", ""credit"": ""NYPL Robert N. Dennis collection (via Commons)"", ""license"": ""Public Domain""}]"
new-york-life-building-1977,New York Life Building,Cass Gilbert’s gilded‑roof tower (completed 1928).,"At Madison Ave & E 26th St, the New York Life Building, completed 1928 with a gilded pyramidal roof, defined the neighborhood skyline in 1977.",40.7431,-73.98755,Flatiron District,"[""architecture"", ""commerce""]",1977,Manhattan,Flatiron District,51 Madison Ave (at E 26th),FLAT-1977,3,"[{""title"": ""New York Life Building"", ""publisher"": ""Wikipedia"", ""url"": ""https://en.wikipedia.org/wiki/New_York_Life_Building""}]","[{""url"": ""https://commons.wikimedia.org/wiki/File:New_York_Life_Building_2011.JPG"", ""credit"": ""Wikimedia Commons"", ""license"": ""CC-BY-SA""}]"
